{
  "$schema": "../navmesh.schema.json",
  "id": "slice",
  "version": 1,
  "source": "ba7adf69",
  "settings": { "cellSize": 0.125, "agentRadius": 0.35, "agentHeight": 1.8, "stepHeight": 0.4, "maxSlope": 45, "maxJump": 2, "maxDrop": 4 },
  "origin": [-6.25, -5.25],
  "polys": [
    [14, 6, 86, 78, 0, 0, 0, 0, -1],
    [46, 78, 54, 79, 0, 0, 0, 0, -1],
    [47, 79, 53, 80, 0, 0, 0, 0, -1],
    [48, 80, 52, 81, 0, 0, 0, 0, -1],
    [48, 81, 52, 83, 0, 0, 0, 0, 0],
    [48, 83, 52, 337, 0, 0, 0, 0, -1],
    [47, 84, 48, 240, 0, 0, 0, 0, -1],
    [52, 84, 53, 240, 0, 0, 0, 0, -1],
    [46, 85, 47, 239, 0, 0, 0, 0, -1],
    [53, 85, 54, 239, 0, 0, 0, 0, -1],
    [54, 147, 55, 177, 0, 0, 0, 0, -1],
    [55, 148, 56, 176, 0, 0, 0, 0, -1],
    [56, 149, 57, 175, 0, 0, 0, 0, -1],
    [57, 150, 67, 174, 0, 0, 0, 0, -1],
    [67, 150, 71, 151, 0, 0, 0, 0, -1],
    [77, 150, 78, 174, 2, 0, 0, 0, -1],
    [67, 151, 69, 152, 0, 0, 0, 0, -1],
    [67, 152, 68, 153, 0, 0, 0, 0, -1],
    [76, 155, 77, 169, 2, 0, 0, 0, -1],
    [75, 156, 76, 168, 2, 0, 0, 0, -1],
    [73, 157, 75, 167, 2, 0, 0, 0, -1],
    [67, 171, 68, 174, 0, 0, 0, 0, -1],
    [68, 172, 69, 174, 0, 0, 0, 0, -1],
    [69, 173, 71, 174, 0, 0, 0, 0, -1],
    [47, 244, 48, 336, 0, 0, 0, 0, -1],
    [52, 244, 53, 336, 0, 0, 0, 0, -1],
    [46, 245, 47, 335, 0, 0, 0, 0, -1],
    [53, 245, 54, 335, 0, 0, 0, 0, -1],
    [6, 246, 25, 334, 0, 0, 0, 0, -1],
    [25, 246, 46, 273, 0, 0, 0, 0, -1],
    [54, 246, 94, 305, 0, 0, 0, 0, -1],
    [25, 273, 27, 274, 0, 0, 0, 0, -1],
    [33, 273, 46, 274, 0, 0, 0, 0, -1],
    [25, 274, 26, 275, 0, 0, 0, 0, -1],
    [34, 274, 46, 275, 0, 0, 0, 0, -1],
    [35, 275, 46, 334, 0, 0, 0, 0, -1],
    [25, 281, 26, 334, 0, 0, 0, 0, -1],
    [34, 281, 35, 334, 0, 0, 0, 0, -1],
    [26, 282, 27, 334, 0, 0, 0, 0, -1],
    [33, 282, 34, 334, 0, 0, 0, 0, -1],
    [27, 283, 33, 334, 0, 0, 0, 0, -1],
    [54, 305, 65, 334, 0, 0, 0, 0, -1],
    [65, 305, 67, 306, 0, 0, 0, 0, -1],
    [73, 305, 94, 306, 0, 0, 0, 0, -1],
    [65, 306, 66, 307, 0, 0, 0, 0, -1],
    [74, 306, 94, 307, 0, 0, 0, 0, -1],
    [75, 307, 95, 334, 0, 0, 0, 0, -1],
    [101, 310, 118, 334, 1.4, 0, 0, 0, -1],
    [65, 313, 66, 334, 0, 0, 0, 0, -1],
    [74, 313, 75, 334, 0, 0, 0, 0, -1],
    [66, 314, 67, 334, 0, 0, 0, 0, -1],
    [73, 314, 74, 334, 0, 0, 0, 0, -1],
    [67, 315, 73, 334, 0, 0, 0, 0, -1],
    [48, 337, 52, 339, 0, 0, 0, 0, 1],
    [48, 339, 52, 358, 0, 0, 0, 0, -1],
    [47, 340, 48, 358, 0, 0, 0, 0, -1],
    [52, 340, 53, 358, 0, 0, 0, 0, -1],
    [46, 341, 47, 358, 0, 0, 0, 0, -1],
    [53, 341, 54, 358, 0, 0, 0, 0, -1]
  ],
  "portals": [
    [0, 1, 46, 78, 54, 78],
    [1, 2, 47, 79, 53, 79],
    [2, 3, 48, 80, 52, 80],
    [3, 4, 48, 81, 52, 81],
    [4, 5, 48, 83, 52, 83],
    [5, 6, 48, 84, 48, 240],
    [5, 7, 52, 84, 52, 240],
    [6, 8, 47, 85, 47, 239],
    [7, 9, 53, 85, 53, 239],
    [9, 10, 54, 147, 54, 177],
    [10, 11, 55, 148, 55, 176],
    [11, 12, 56, 149, 56, 175],
    [12, 13, 57, 150, 57, 174],
    [13, 14, 67, 150, 67, 151],
    [14, 16, 67, 151, 69, 151],
    [13, 16, 67, 151, 67, 152],
    [16, 17, 67, 152, 68, 152],
    [13, 17, 67, 152, 67, 153],
    [15, 18, 77, 155, 77, 169],
    [18, 19, 76, 156, 76, 168],
    [19, 20, 75, 157, 75, 167],
    [13, 21, 67, 171, 67, 174],
    [21, 22, 68, 172, 68, 174],
    [22, 23, 69, 173, 69, 174],
    [5, 24, 48, 244, 48, 336],
    [5, 25, 52, 244, 52, 336],
    [24, 26, 47, 245, 47, 335],
    [25, 27, 53, 245, 53, 335],
    [28, 29, 25, 246, 25, 273],
    [26, 29, 46, 246, 46, 273],
    [27, 30, 54, 246, 54, 305],
    [29, 31, 25, 273, 27, 273],
    [29, 32, 33, 273, 46, 273],
    [28, 31, 25, 273, 25, 274],
    [31, 33, 25, 274, 26, 274],
    [32, 34, 34, 274, 46, 274],
    [26, 32, 46, 273, 46, 274],
    [28, 33, 25, 274, 25, 275],
    [34, 35, 35, 275, 46, 275],
    [26, 34, 46, 274, 46, 275],
    [26, 35, 46, 275, 46, 334],
    [28, 36, 25, 281, 25, 334],
    [35, 37, 35, 281, 35, 334],
    [36, 38, 26, 282, 26, 334],
    [37, 39, 34, 282, 34, 334],
    [38, 40, 27, 283, 27, 334],
    [39, 40, 33, 283, 33, 334],
    [30, 41, 54, 305, 65, 305],
    [30, 42, 65, 305, 67, 305],
    [30, 43, 73, 305, 94, 305],
    [27, 41, 54, 305, 54, 334],
    [41, 42, 65, 305, 65, 306],
    [42, 44, 65, 306, 66, 306],
    [43, 45, 74, 306, 94, 306],
    [41, 44, 65, 306, 65, 307],
    [45, 46, 75, 307, 94, 307],
    [41, 48, 65, 313, 65, 334],
    [46, 49, 75, 313, 75, 334],
    [48, 50, 66, 314, 66, 334],
    [49, 51, 74, 314, 74, 334],
    [50, 52, 67, 315, 67, 334],
    [51, 52, 73, 315, 73, 334],
    [5, 53, 48, 337, 52, 337],
    [53, 54, 48, 339, 52, 339],
    [54, 55, 48, 340, 48, 358],
    [54, 56, 52, 340, 52, 358],
    [55, 57, 47, 341, 47, 358],
    [56, 58, 53, 341, 53, 358]
  ],
  "links": [
    [0, 13, 20, 2.0625, 0, 14.875, 2.875, 2, 14.875, 2],
    [0, 13, 15, 2.0625, 0, 16, 3.375, 2, 16, 2],
    [0, 14, 15, 2.5625, 0, 13.5625, 3.375, 2, 13.5625, 2],
    [1, 15, 17, 3.4375, 2, 13.8125, 2.25, 0, 13.8125, 2],
    [1, 15, 21, 3.4375, 2, 16.1875, 2.25, 0, 16.1875, 2],
    [0, 16, 15, 2.3125, 0, 13.6875, 3.375, 2, 13.6875, 2],
    [0, 17, 15, 2.1875, 0, 13.8125, 3.375, 2, 13.8125, 2],
    [1, 18, 13, 3.3125, 2, 14.1875, 2.125, 0, 14.1875, 2],
    [1, 18, 13, 3.3125, 2, 15.8125, 2.125, 0, 15.8125, 2],
    [1, 19, 13, 3.1875, 2, 14.3125, 2.125, 0, 14.3125, 2],
    [1, 19, 13, 3.1875, 2, 15.6875, 2.125, 0, 15.6875, 2],
    [1, 20, 13, 2.9375, 2, 15, 2.125, 0, 15, 2],
    [0, 21, 15, 2.1875, 0, 16.1875, 3.375, 2, 16.1875, 2],
    [0, 22, 15, 2.3125, 0, 16.3125, 3.375, 2, 16.3125, 2],
    [0, 23, 15, 2.5625, 0, 16.4375, 3.375, 2, 16.4375, 2],
    [0, 46, 47, 5.5625, 0, 34.125, 6.375, 1.4, 34.125, 1.4],
    [0, 46, 47, 5.5625, 0, 35.8125, 6.375, 1.4, 35.8125, 1.4],
    [1, 47, 46, 6.4375, 1.4, 34.5, 5.625, 0, 34.5, 1.4],
    [1, 47, 46, 6.4375, 1.4, 36, 5.625, 0, 36, 1.4],
    [2, 13, 15, 2.125, 0, 15, 3.475, 2, 15, 2],
    [2, 15, 13, 3.475, 2, 15, 2.125, 0, 15, 2],
    [2, 13, 20, 2.075, 0, 15, 3.025, 2, 15, 1],
    [2, 20, 13, 3.025, 2, 15, 2.075, 0, 15, 1],
    [2, 46, 47, 5.525, 0, 35, 6.475, 1.4, 35, 2],
    [2, 47, 46, 6.475, 1.4, 35, 5.525, 0, 35, 2]
  ],
  "doors": ["spawn-door", "exit-door"]
}
